{
  "$schema": "https://json-schema.org/draft/2020-12/schema",
  "title": "kernel-opt-loop binding ledger",
  "type": "object",
  "additionalProperties": false,
  "required": ["schema_version", "decision_sha256", "sketch_sha256", "candidate_path", "candidate_sha256", "bindings"],
  "properties": {
    "schema_version": {"const": 1},
    "round": {"type": "string", "pattern": "^[0-9]{3}$"},
    "artifact_kind": {"const": "submission-finalization"},
    "artifact_index": {"type": "string", "pattern": "^[0-9]{3}$"},
    "decision_sha256": {"type": "string", "pattern": "^[0-9a-f]{64}$"},
    "sketch_sha256": {"type": "string", "pattern": "^[0-9a-f]{64}$"},
    "candidate_path": {"type": "string"},
    "candidate_sha256": {"type": "string", "pattern": "^[0-9a-f]{64}$"},
    "source_analyzer": {"type": "string"},
    "binding_model": {"type": "string"},
    "bindings": {
      "type": "array",
      "minItems": 1,
      "items": {
        "type": "object",
        "additionalProperties": false,
        "required": [
          "statement_id",
          "relation",
          "contract_name",
          "implementation_symbol",
          "source_spans",
          "status"
        ],
        "properties": {
          "statement_id": {"type": "string"},
          "relation": {"enum": ["implemented-by", "fused-into", "expanded-into", "elided-by"]},
          "contract_name": {"type": "string"},
          "implementation_symbol": {"type": "string"},
          "source_spans": {
            "type": "array",
            "minItems": 1,
            "items": {
              "type": "object",
              "additionalProperties": false,
              "required": ["path", "start", "end"],
              "properties": {
                "path": {"type": "string"},
                "start": {"type": "array", "minItems": 2, "maxItems": 2, "items": {"type": "integer"}},
                "end": {"type": "array", "minItems": 2, "maxItems": 2, "items": {"type": "integer"}}
              }
            }
          },
          "status": {"enum": ["implemented", "accommodated", "elided"]},
          "reason": {"type": "string"},
          "notes": {"type": "string"},
          "evidence": {"type": "array", "items": {"type": "string"}}
        }
      }
    }
  },
  "oneOf": [
    {"required": ["round"]},
    {
      "required": ["artifact_kind", "artifact_index"],
      "not": {"required": ["round"]}
    }
  ]
}
