{
  "binding_model": "primitive-call",
  "bindings": [
    {
      "contract_name": "memory.load",
      "evidence": [
        "log/probes/p01_r001_capability_probe.py",
        "log/probes/p01_r001_capability_result.json"
      ],
      "implementation_symbol": "tl.load",
      "notes": "grid (1,) single program: flat_ids (int64 from aten topk) is loaded then narrowed kernel-side with .to(tl.int32); the token index r//K is derived in-register. Qualifies the profile's `cast.narrow` int64->int32 kernel-side entry, recorded `unknown` in the frozen snapshot.",
      "reason": "Statement op_load_rows is realized on the memory.load/tl.load primitive at the recorded span. A reason is supplied unconditionally because several sketch statements resolve onto shared primitive spans in this fused two-kernel implementation, and the validator requires one in that case.",
      "relation": "implemented-by",
      "source_spans": [
        {
          "end": [
            117,
            57
          ],
          "path": "triton_fused_moe_e2_001.py",
          "start": [
            117,
            11
          ]
        }
      ],
      "statement_id": "op_load_rows",
      "status": "implemented"
    },
    {
      "contract_name": "arithmetic.select",
      "evidence": [
        "log/probes/p01b_r001_countingsort_isolate.py",
        "log/probes/p01c_r001_prefixsum_isolate.py",
        "log/probes/p01d_r001_p5_robustness.py"
      ],
      "implementation_symbol": "tl.where",
      "notes": "counts[b] = tl.sum(mask_b) reduced over the [BLOCK_ROWS] lanes and deposited into lane b with an int32 multiplier, inside tl.static_range(E). Reduce-based deposit is REQUIRED: the masked-add lane deposit `counts = counts + one_if` is a hard compile error (shapes 8 vs 256).",
      "reason": "ACCOMMODATED: the bucket count is `counts[b] = tl.sum(tl.where((ids == b) & valid, 1, 0).to(tl.int32))` inside tl.static_range(E). The profile has no `reduction.sum` entry at all, so the reduce cannot be bound to a declared contract; the binding records the declared primitive that BUILDs the counted mask (arithmetic.select / tl.where) and declares the site accommodated rather than claiming an undeclared reduction contract. The masked-add form the invariant literally names is a hard compile error (shapes 8 vs 256) -- see p01b.",
      "relation": "implemented-by",
      "source_spans": [
        {
          "end": [
            128,
            58
          ],
          "path": "triton_fused_moe_e2_001.py",
          "start": [
            128,
            24
          ]
        }
      ],
      "statement_id": "op_bucket_count",
      "status": "accommodated"
    },
    {
      "contract_name": "arithmetic.select",
      "evidence": [
        "log/probes/p01c_r001_prefixsum_isolate.py",
        "log/probes/p01d_r001_p5_robustness.py"
      ],
      "implementation_symbol": "tl.where",
      "notes": "offsets[b] = tl.sum(counts where be < b), reduce-based. The lane-deposit forms tl.where(be == b, x, 0) and (be == b).to(tl.int32) * x COMPILE BUT SILENTLY YIELD ZEROS on this rig (p01c P1-P4 all returned [0]*8); only the reduce form is correct.",
      "reason": "ACCOMMODATED: the exclusive prefix scan is `offsets[b] = tl.sum(tl.where(be < b, counts, 0))` inside tl.static_range(E). Same rationale as op_bucket_count: the profile declares no reduction.sum contract, so the binding records the declared primitive that builds the scanned mask (arithmetic.select / tl.where) and declares the site accommodated. The lane-deposit forms tl.where(be == b, x, 0) and (be == b).to(tl.int32) * x COMPILE BUT SILENTLY YIELD ZEROS on this rig (p01c P1-P4 all returned [0]*8).",
      "relation": "implemented-by",
      "source_spans": [
        {
          "end": [
            134,
            49
          ],
          "path": "triton_fused_moe_e2_001.py",
          "start": [
            134,
            22
          ]
        }
      ],
      "statement_id": "op_bucket_scan",
      "status": "accommodated"
    },
    {
      "contract_name": "memory.store",
      "implementation_symbol": "tl.store",
      "notes": "aten view(-1) at line 379; no host data-dependent branch. Shared span with op_store_meta (same store instruction writes both derived arrays), which is why a reason is required.",
      "reason": "Statement is realized in two parts: the aten flatten topk_ids.view(-1) at line 379 produces flat_ids, and the Triton-side span recorded here is the store of the derived count metadata consumed downstream.",
      "relation": "implemented-by",
      "source_spans": [
        {
          "end": [
            137,
            38
          ],
          "path": "triton_fused_moe_e2_001.py",
          "start": [
            137,
            5
          ]
        }
      ],
      "statement_id": "op_flatten",
      "status": "implemented"
    },
    {
      "contract_name": "memory.store",
      "implementation_symbol": "tl.store",
      "notes": "aten renorm + .to(fp16) at lines 375-377, tie semantics verbatim from the epoch-1 canonical source. Shared span with op_store_meta, hence the reason.",
      "reason": "Statement is realized in two parts: the aten renormalize divide and fp16 cast at lines 375-377 produce flat_w, and the Triton-side span recorded here is the store of the derived offset metadata consumed downstream.",
      "relation": "implemented-by",
      "source_spans": [
        {
          "end": [
            138,
            40
          ],
          "path": "triton_fused_moe_e2_001.py",
          "start": [
            138,
            5
          ]
        }
      ],
      "statement_id": "op_renorm",
      "status": "implemented"
    },
    {
      "contract_name": "memory.store",
      "implementation_symbol": "tl.store",
      "notes": "expert_counts / expert_offsets, int32, [E].",
      "reason": "Two spans: line 137 stores expert_counts and line 138 stores expert_offsets; both are the materialization of the counting-sort metadata into the [E] int32 tiles the expert kernel reads.",
      "relation": "implemented-by",
      "source_spans": [
        {
          "end": [
            137,
            38
          ],
          "path": "triton_fused_moe_e2_001.py",
          "start": [
            137,
            5
          ]
        },
        {
          "end": [
            138,
            40
          ],
          "path": "triton_fused_moe_e2_001.py",
          "start": [
            138,
            5
          ]
        }
      ],
      "statement_id": "op_store_meta",
      "status": "implemented"
    },
    {
      "contract_name": "memory.store",
      "evidence": [
        "log/probes/p02c_r001_sort_alternatives.py",
        "log/probes/p02e_r001_scatter_correct.py",
        "log/probes/p02f_r001_u5_robustness.py"
      ],
      "implementation_symbol": "tl.store",
      "notes": "dest = base + rank where rank comes from a [BLOCK_ROWS, E] (256x8) matrix reduced on the 8-wide axis, NOT a [BLOCK_ROWS, BLOCK_ROWS] (256x256) one. The 256x256 form measures 553.9 us/call (95% of pipeline); the 256x8 form measures 26.2-36.8 us/call and is bitwise-equal to a host stable counting sort on 18 id vectors across 6 activation patterns, deterministic over 20 runs. Stable (rank follows flat row order).",
      "reason": "Two spans: line 154 scatters the token index into sorted_rows and line 155 scatters the routing weight into sorted_w, both indexed by the computed destination slot.",
      "relation": "implemented-by",
      "source_spans": [
        {
          "end": [
            154,
            56
          ],
          "path": "triton_fused_moe_e2_001.py",
          "start": [
            154,
            5
          ]
        },
        {
          "end": [
            155,
            49
          ],
          "path": "triton_fused_moe_e2_001.py",
          "start": [
            155,
            5
          ]
        }
      ],
      "statement_id": "op_scatter",
      "status": "implemented"
    },
    {
      "contract_name": "memory.load",
      "evidence": [
        "log/probes/p03_r001_candidate_gates.py"
      ],
      "implementation_symbol": "tl.load",
      "notes": "aten torch.softmax in fp32 at line 373, inside the captured region, verbatim epoch-1 semantics. The recorded span is the Triton load of the routing input as consumed by the captured pipeline.",
      "reason": "Statement op_softmax is realized on the memory.load/tl.load primitive at the recorded span. A reason is supplied unconditionally because several sketch statements resolve onto shared primitive spans in this fused two-kernel implementation, and the validator requires one in that case.",
      "relation": "implemented-by",
      "source_spans": [
        {
          "end": [
            118,
            55
          ],
          "path": "triton_fused_moe_e2_001.py",
          "start": [
            118,
            9
          ]
        }
      ],
      "statement_id": "op_softmax",
      "status": "implemented"
    },
    {
      "contract_name": "memory.store",
      "implementation_symbol": "tl.store",
      "notes": "torch.topk at line 374; tie order frozen, never re-derived.",
      "reason": "aten torch.topk writes fp32 weights and int64 ids at line 374 with tie semantics preserved verbatim; the Triton-side span recorded is the store of the routed weight into the sorted buffer.",
      "relation": "implemented-by",
      "source_spans": [
        {
          "end": [
            155,
            49
          ],
          "path": "triton_fused_moe_e2_001.py",
          "start": [
            155,
            5
          ]
        }
      ],
      "statement_id": "op_topk",
      "status": "implemented"
    },
    {
      "contract_name": "memory.load",
      "implementation_symbol": "tl.load",